[
  {
    "id": "materials-paradigm",
    "domainId": "foundations",
    "slug": "materials-paradigm",
    "title": "Materials paradigm",
    "summary": "Connect processing, structure, properties, and performance.",
    "prerequisiteTopicIds": [],
    "level": "foundation",
    "order": 1,
    "status": "published"
  },
  {
    "id": "atomic-bonding",
    "domainId": "foundations",
    "slug": "atomic-bonding",
    "title": "Atomic structure and bonding",
    "summary": "Relate bond type and bond energy to engineering behavior.",
    "prerequisiteTopicIds": ["materials-paradigm"],
    "level": "foundation",
    "order": 2,
    "status": "planned"
  },
  {
    "id": "crystal-structures",
    "domainId": "structure-microstructure",
    "slug": "crystal-structures",
    "title": "Crystal structures",
    "summary": "Compare unit cells, packing, directions, and planes.",
    "prerequisiteTopicIds": ["atomic-bonding"],
    "level": "foundation",
    "order": 3,
    "status": "published"
  },
  {
    "id": "defects-microstructure",
    "domainId": "structure-microstructure",
    "slug": "defects-microstructure",
    "title": "Defects and microstructure",
    "summary": "Recognize vacancies, dislocations, grains, and interfaces.",
    "prerequisiteTopicIds": ["crystal-structures"],
    "level": "foundation",
    "order": 4,
    "status": "planned"
  },
  {
    "id": "diffusion",
    "domainId": "thermodynamics-kinetics",
    "slug": "diffusion",
    "title": "Diffusion",
    "summary": "Use Fick's laws and Arrhenius behavior to explain mass transport.",
    "prerequisiteTopicIds": ["defects-microstructure"],
    "level": "foundation",
    "order": 5,
    "status": "published"
  },
  {
    "id": "phase-diagrams",
    "domainId": "thermodynamics-kinetics",
    "slug": "phase-diagrams",
    "title": "Phase diagrams",
    "summary": "Read equilibrium phases, compositions, and phase fractions.",
    "prerequisiteTopicIds": ["diffusion"],
    "level": "foundation",
    "order": 6,
    "status": "planned"
  },
  {
    "id": "mechanical-properties",
    "domainId": "properties-performance",
    "slug": "mechanical-properties",
    "title": "Mechanical properties",
    "summary": "Interpret elastic, plastic, fracture, fatigue, and creep response.",
    "prerequisiteTopicIds": ["defects-microstructure"],
    "level": "foundation",
    "order": 7,
    "status": "published"
  },
  {
    "id": "strengthening",
    "domainId": "properties-performance",
    "slug": "strengthening",
    "title": "Strengthening",
    "summary": "Explain how microstructure hinders dislocation motion.",
    "prerequisiteTopicIds": ["mechanical-properties"],
    "level": "intermediate",
    "order": 8,
    "status": "planned"
  },
  {
    "id": "failure",
    "domainId": "properties-performance",
    "slug": "failure",
    "title": "Failure",
    "summary": "Connect flaws, loading history, and environment to failure modes.",
    "prerequisiteTopicIds": ["mechanical-properties"],
    "level": "intermediate",
    "order": 9,
    "status": "planned"
  },
  {
    "id": "materials-selection",
    "domainId": "design-sustainability",
    "slug": "materials-selection",
    "title": "Materials selection",
    "summary": "Use property charts and constraints to compare candidates.",
    "prerequisiteTopicIds": ["mechanical-properties", "failure"],
    "level": "intermediate",
    "order": 10,
    "status": "planned"
  }
]
